ghét mấy thằng lìn quay dọc vl,1,,,,,,,,,,,,,
Lại thèm lone Ngọc Trinh chứ sao. Ông cứ văn,1,,,,,,,,,,,,,
1đảng là do dân vì cán bộ.....vcc,1,,,,,,,,,,,,,
"phá hoại hạnh phúc nhà ngta , đâu có ảnh hưởng miếng cơm manh áo nhà bạn mà bán báo",0,,,,,,,,,,,,,
thằng VC nào thì củng đều là lưu manh và gian trá .... chức quyền càng cao thì độ lưu manh càng lớn .... ĐM bọn VC ...!!,1,,,,,,,,,,,,,
Lẽ ra ngay từ đầu nó đéo nên về thì hơn,1,,,,,,,,,,,,,
V abe là con đỹ à,1,,,,,,,,,,,,,
nguoi ta co xau hay tot thi moi nguoi biet.  neu Co Hieu ko tot sao moi nguoi thich.  Dan ba gi ma cai mieng xau nhu vay cung co nguoi lay.,0,,,,,,,,,,,,,
anh Kiên tổ trưởng đang lập công mừng chức mới đây mà ! bởi vì nó chả ảnh hưởng đến người nghèo nên chăng anh tư vấn cho thủ tướng dựng 2km một trạm luôn cho máu đi anh !,0,,,,,,,,,,,,,
